{
    "$schema": "../glass-schema.json",
    "id": "willi",
    "display_name": "Willibecher",
    "common_volumes_ml": [
        200,
        250,
        300,
        400,
        500
    ],
    "icon": {
        "viewbox_width": 100,
        "viewbox_height": 180,
        "outline": "M 14 20 Q 18 95 28 156 Q 28 160 32 160 L 68 160 Q 72 160 72 156 Q 82 95 86 20",
        "rim": [
            "M 10 20 L 90 20",
            "M 24 150 L 76 150"
        ]
    }
}